{
  "$schema": "https://json-schema.org/draft/2020-12/schema",
  "title": "Fideon canonical schema - auto (policy_check)",
  "description": "SPEC_21 section 4 canonical schema for auto, commercial (business) auto (code AU), composing common_model.json 1.1.0 by $ref: the envelope plus locations (garaging), vehicles, drivers, rating_exposures (hired auto cost of hire, non-ownership employees), rating_modifiers and countersignature. Built from the labels the line's 11 single-LOB seed documents of 5 carriers print (read in place: the business auto declarations, schedules of covered autos, Items Two to Five and the forms schedules), every field of the pre-SPEC_21 auto.json 1.5.0 (auto.crosswalk.yaml) and the line's L1 registry YAMLs. No LOB block.",
  "fideon:doc_type": "policy_check",
  "fideon:lob": "auto",
  "fideon:lob_code": "AU",
  "fideon:layout_family": "casualty_fleet",
  "fideon:schema_version": "2.0.0",
  "fideon:common_model_version": "1.1.0",
  "fideon:status": "SPEC_21 schema (10 October 2026) replacing the generated pre-SPEC_21 auto.json 1.5.0; draft for the project owner's approval. The 11 seed golds are drafted against it (DRAFT, pending reviewer sign-off).",
  "fideon:built_from": {
    "seed_golds": 11,
    "documents_read": 11,
    "carriers": [
      "Hartford Insurance Company of Illinois (The Hartford)",
      "Merchants Mutual Insurance Company",
      "National Union Fire Insurance Company of Pittsburgh, Pa. (VFIS / Glatfelter)",
      "Preferred Mutual Insurance Company",
      "Progressive Preferred Insurance Co / Progressive Specialty Insurance Co"
    ],
    "legacy_schema": "auto.json 1.5.0 (pre-SPEC_21, fideon.canonical.commercial_auto)",
    "registry_yamls": [
      "auto",
      "autob"
    ],
    "corpora": [
      "synth_core/fideon/synth_core/data/source data/<Carrier>/autob/ (11 documents, seeds)"
    ]
  },
  "fideon:blocks_used": [
    "locations",
    "vehicles",
    "drivers",
    "rating_exposures",
    "rating_modifiers",
    "countersignature"
  ],
  "fideon:lob_block": "None. Every concept the commercial auto documents print has a home in the envelope or a common-model building block (SPEC_21 4.2.4): Item Two rows are coverages[] (covered_auto_symbols, limits, premium), each scheduled auto's coverage lines are coverages[] with applies_to the vehicle, hired auto cost of hire and non-ownership employee counts are rating_exposures[]. A scheduled auto's class code, radius, size and territory factors have no Vehicle field and travel as additional_fields (section_hint the vehicle; CR-AU-03).",
  "fideon:coverage_codes_file": "auto.coverage_codes.yaml",
  "fideon:coverage_codes": [
    "X_VEHICLE_LIABILITY",
    "AU_SUPPLEMENTAL_SPOUSAL_LIABILITY",
    "X_PIP",
    "AU_ADDITIONAL_PIP",
    "AU_OPTIONAL_BASIC_ECONOMIC_LOSS",
    "AU_AGGREGATE_NO_FAULT_BENEFITS",
    "X_MED_PAY",
    "X_UM",
    "X_UIM",
    "X_COMPREHENSIVE",
    "AU_SPECIFIED_CAUSES_OF_LOSS",
    "X_COLLISION",
    "X_TOWING",
    "X_RENTAL",
    "AU_DOWNTIME_RENTAL_TOWING",
    "AU_HIRED_AUTO_LIABILITY",
    "AU_NON_OWNERSHIP_LIABILITY",
    "AU_HIRED_AUTO_PHYSICAL_DAMAGE",
    "AU_FULL_GLASS",
    "AU_COVERAGE_EXTENSION",
    "AU_OTHER_AUTO_COVERAGES",
    "X_ADDITIONAL_INSURED",
    "X_WAIVER_OF_SUBROGATION"
  ],
  "fideon:mandatory_fields": [
    "carrier.name",
    "named_insured.primary_name",
    "policy.policy_number",
    "policy.effective_date",
    "policy.expiration_date",
    "coverages[].limits[].amount"
  ],
  "fideon:audit_rules": [
    "policy.effective_date < policy.expiration_date",
    "months_between(policy.effective_date, policy.expiration_date) == policy.term_months",
    "policy.effective_date <= document.transaction_effective_date <= policy.expiration_date",
    "len(coverages[].limits[]) >= 1"
  ],
  "fideon:audit_rules_note": "Rules 1-4 are common_model.json fideon:default_audit_rules without the claims-made rule: commercial auto is occurrence-based. The term rule applies where the term is printed (Progressive's '12 month').",
  "fideon:aliases": {
    "billing.bill_type": [
      "Direct Bill",
      "LIST BILL"
    ],
    "billing.installments[].due_date": [
      "DUE"
    ],
    "carrier.name": [
      "Underwritten by",
      "Name of Insurance Company",
      "Company",
      "Coverage Part and Insurance Company Summary"
    ],
    "countersignature.date": [
      "Countersigned by",
      "COUNTERSIGNED",
      "Authorized representative (countersignature, where required)"
    ],
    "coverages[].covered_auto_symbols[]": [
      "Covered Autos",
      "Covered Auto Symbols",
      "SYMBOLS"
    ],
    "coverages[].deductibles[].amount": [
      "Deductible",
      "DEDUCT"
    ],
    "coverages[].limits[].amount": [
      "Limit",
      "Limits",
      "Limit of Insurance",
      "Limit Or Deductible",
      "LIMITS"
    ],
    "coverages[].premium": [
      "Premium",
      "Advance Premium",
      "PREMIUM"
    ],
    "document.issue_date": [
      "DATE PREPARED",
      "Date Prepared"
    ],
    "document.print_date": [
      "Date Printed"
    ],
    "document.transaction_type": [
      "Transaction Type"
    ],
    "drivers[].date_of_birth": [
      "DOB"
    ],
    "drivers[].license_number": [
      "License Number"
    ],
    "drivers[].license_state": [
      "License State"
    ],
    "drivers[].name": [
      "Rated drivers",
      "DRIVERS LIST",
      "Name"
    ],
    "forms_and_endorsements[].form_number": [
      "Form Numbers of Coverage Forms, Endorsements and Schedules that are part of this Coverage Part",
      "FORMS AND ENDORSEMENTS ATTACHED AT INCEPTION",
      "ENDORSEMENTS ATTACHED TO THIS POLICY",
      "SCHEDULE OF FORMS AND ENDORSEMENTS"
    ],
    "interested_parties[].name": [
      "LOSS PAYEE(s)",
      "LOSS PAYEES",
      "Loss Payee",
      "Loss Payee information"
    ],
    "locations[].address.city": [
      "GARAGED",
      "Garaging Address",
      "TOWN & STATE WHERE PRINCIPALLY GARAGED"
    ],
    "locations[].address.postal_code": [
      "Garaging Zip Code",
      "ZIP CODE"
    ],
    "locations[].territory": [
      "TERR",
      "Territory",
      "TERRITORY"
    ],
    "named_insured.additional_named_insureds[].name": [
      "SCHEDULE OF NAMED INSURED(S)"
    ],
    "named_insured.business_description": [
      "Business Description",
      "BUSINESS DESCRIPTION"
    ],
    "named_insured.entity_type": [
      "Type of Entity",
      "Form of Business",
      "FORM OF BUSINESS",
      "The named insured organization type is"
    ],
    "named_insured.primary_name": [
      "Named Insured",
      "Named insured",
      "NAMED INSURED",
      "Named Insured and Mailing Address",
      "Applicant/Named Insured",
      "Policy was prepared for",
      "Especially Designed For"
    ],
    "policy.effective_date": [
      "Policy Period",
      "POLICY PERIOD",
      "Effective Date",
      "From"
    ],
    "policy.expiration_date": [
      "Policy Period",
      "POLICY PERIOD",
      "Expiration Date of Policy",
      "To"
    ],
    "policy.policy_number": [
      "Policy Number",
      "POLICY NUMBER",
      "Policy number",
      "Policy No.",
      "POLICY NO."
    ],
    "policy.prior_policy_number": [
      "Previous Policy Number",
      "PREVIOUS POLICY NUMBER"
    ],
    "policy.subject_to_audit": [
      "SUBJECT TO AUDIT"
    ],
    "premium.taxes_fees[].amount": [
      "NY Motor Vehicle Law Enforcement Fee",
      "Motor Vehicle Law Enforcement Fee",
      "NEW YORK MOTOR VEHICLE LAW ENFORCEMENT FEE",
      "PREMIUM FOR AUTOMOBILE NYMVLEF"
    ],
    "premium.total": [
      "Total Advance Premium",
      "TOTAL ADVANCE PREMIUM",
      "Total Premium",
      "TOTAL POLICY PREMIUM",
      "ESTIMATED TOTAL PREMIUM",
      "Estimated Total Premium",
      "Total 12 month policy premium and fees"
    ],
    "producer.agency_name": [
      "Agent/Broker Name",
      "Producer",
      "Your Agent",
      "Agency Name",
      "Preferred Mutual representative"
    ],
    "producer.producer_code": [
      "Producer",
      "Your Agent"
    ],
    "rating_exposures[].class_code": [
      "CLASS",
      "Class Code",
      "CLASS CODE",
      "Size Class"
    ],
    "rating_exposures[].exposure_amount": [
      "Estimated Cost of Hire",
      "ESTIMATED ANNUAL COST OF HIRE",
      "Number"
    ],
    "rating_exposures[].exposure_basis": [
      "Rating Basis",
      "RATING BASIS"
    ],
    "rating_exposures[].rate": [
      "Rate Per Each $100 Cost of Hire"
    ],
    "vehicles[].body_type": [
      "Body type",
      "Body Type"
    ],
    "vehicles[].cost_new": [
      "ORIG. COST NEW",
      "Cost New",
      "ORIGINAL COST"
    ],
    "vehicles[].make": [
      "Make"
    ],
    "vehicles[].model": [
      "Model"
    ],
    "vehicles[].stated_amount": [
      "Stated Amount",
      "Value"
    ],
    "vehicles[].use": [
      "Personal use",
      "Bus. Use",
      "Use"
    ],
    "vehicles[].vehicle_number": [
      "NO.",
      "COVERED AUTO NO.",
      "Covered Auto No.",
      "Vehicle #",
      "Vehicle Number"
    ],
    "vehicles[].vin": [
      "VIN",
      "ID NO.",
      "V.I.N.",
      "VEHICLE IDENTIFICATION NUMBER (VIN)"
    ],
    "vehicles[].year": [
      "Year"
    ]
  },
  "type": "object",
  "additionalProperties": false,
  "required": [
    "document",
    "carrier",
    "named_insured",
    "policy",
    "lob_parts",
    "coverages"
  ],
  "properties": {
    "document": {
      "$ref": "../common/common_model.json#/$defs/document"
    },
    "carrier": {
      "$ref": "../common/common_model.json#/$defs/carrier"
    },
    "producer": {
      "$ref": "../common/common_model.json#/$defs/producer"
    },
    "named_insured": {
      "$ref": "../common/common_model.json#/$defs/named_insured"
    },
    "policy": {
      "$ref": "../common/common_model.json#/$defs/policy"
    },
    "lob_parts": {
      "$ref": "../common/common_model.json#/$defs/lob_parts"
    },
    "coverages": {
      "$ref": "../common/common_model.json#/$defs/coverages"
    },
    "deductibles": {
      "$ref": "../common/common_model.json#/$defs/deductibles"
    },
    "interested_parties": {
      "$ref": "../common/common_model.json#/$defs/interested_parties"
    },
    "premium": {
      "$ref": "../common/common_model.json#/$defs/premium"
    },
    "billing": {
      "$ref": "../common/common_model.json#/$defs/billing"
    },
    "forms_and_endorsements": {
      "$ref": "../common/common_model.json#/$defs/forms_and_endorsements"
    },
    "locations": {
      "$ref": "../common/common_model.json#/$defs/locations"
    },
    "vehicles": {
      "$ref": "../common/common_model.json#/$defs/vehicles"
    },
    "drivers": {
      "$ref": "../common/common_model.json#/$defs/drivers"
    },
    "rating_exposures": {
      "$ref": "../common/common_model.json#/$defs/rating_exposures"
    },
    "rating_modifiers": {
      "$ref": "../common/common_model.json#/$defs/rating_modifiers"
    },
    "countersignature": {
      "$ref": "../common/common_model.json#/$defs/countersignature"
    },
    "additional_fields": {
      "$ref": "../common/common_model.json#/$defs/additional_fields"
    },
    "text_sections": {
      "$ref": "../common/common_model.json#/$defs/text_sections"
    },
    "fideon:provenance": {
      "$ref": "../common/common_model.json#/$defs/provenance"
    }
  }
}
